{
  "schemaVersion": 2,
  "caseId": "nvda-live-region-en-us-desktop",
  "source": "HooVDA",
  "profile": "nvda-web-2026.1.1",
  "locale": "en-US",
  "keyboardLayout": "desktop",
  "steps": [
    {
      "command": "activate",
      "speech": ["Order review ready"],
      "braille": ["Order review ready"],
      "mode": "focus",
      "raw": {
        "capture": "linux-container-chromium-at-spi",
        "politeness": "assertive",
        "gesture": "enter"
      }
    }
  ]
}
