{
  "schemaVersion": 2,
  "caseId": "nvda-aria-details-de-de-laptop",
  "source": "HooVDA",
  "profile": "nvda-web-2026.1.1",
  "locale": "de-DE",
  "keyboardLayout": "laptop",
  "steps": [
    {
      "command": "nextFocusable",
      "speech": ["push me  Schalter  Hat Details"],
      "braille": ["push me sltr Details"],
      "mode": "focus",
      "raw": {
        "capture": "linux-container-chromium-at-spi",
        "setup": ["focus first button", "clear captured output"],
        "gesture": "tab"
      }
    },
    {
      "command": "reportDetails",
      "speech": ["Press to self-destruct"],
      "braille": ["Press to self-destruct"],
      "mode": "focus",
      "raw": {
        "capture": "linux-container-chromium-at-spi",
        "gesture": "capslock+d"
      }
    }
  ]
}
